{
  "submissionId": "018f0000-0000-7000-8000-000000000004",
  "source": "account",
  "market": "SK",
  "locale": "sk",
  "customer": {
    "name": "Meno zákazníka",
    "email": "customer@example.com",
    "phone": "+421 901 730 066"
  },
  "contract": {
    "orderNumber": "ORDER-10002",
    "saleorOrderId": "saleor-order-id",
    "saleorCustomerId": "saleor-customer-id"
  },
  "scope": "wholeOrder",
  "items": null,
  "note": null,
  "legalNoticeVersion": "withdrawal-notice-version",
  "privacyNoticeVersion": "privacy-notice-version"
}
